<?xml version="1.0" encoding="UTF-8"?>
<tns:patient xmlns:tns="http://www.UdemyCourse.com/Patient" xmlns:xsi="http://www.w3.org/2001/XMLSchema-instance" xsi:schemaLocation="http://www.UdemyCourse.com/Patient Patient.xsd ">
  <tns:id>1</tns:id>
   <tns:id>1</tns:id>
  <tns:name>apoorva</tns:name>
  <tns:age>27</tns:age>
  <tns:dob>2001-01-01</tns:dob>
  <tns:email>tns:email</tns:email>
  <tns:gender>F</tns:gender>
  <tns:phone>tns:phone</tns:phone>
  <tns:payment>
    <tns:insurance>
    	<tns:limit>1000</tns:limit>
    	<tns:provider>Cigna</tns:provider>
    </tns:insurance>
  </tns:payment>
</tns:patient>
